{
	"slug": "non-running",
	"brief_version": "1.1.0",
	"generated": {
		"by": "create-content-brief.py",
		"note": "Assembled from research artifacts. Structure is derived from this page's own purpose and evidence — there is deliberately no master section template."
	},
	"page_type": "service",
	"page_purpose_class": "differentiated_informational",
	"page_purpose": "UNDETERMINED — no approved angle establishes why this page should exist.",
	"primary_topic": "junk car buying — non running",
	"primary_intent": "transactional",
	"secondary_intents": [
		"commercial_investigation",
		"navigational_local",
		"informational"
	],
	"conversion_goal": "Phone call or instant-offer submission",
	"gate": {
		"status": "BLOCKED",
		"checks": [
			{
				"check": "differentiation_supported",
				"passed": false,
				"detail": "differentiation_verdict is 'NO_SUPPORTED_DIFFERENTIATION'"
			},
			{
				"check": "approved_angle_exists",
				"passed": false,
				"detail": "angle statuses present: none"
			},
			{
				"check": "publishable_claims_exist",
				"passed": true,
				"detail": "9 of 26 claims are publishable"
			},
			{
				"check": "high_risk_claims_authoritative",
				"passed": true,
				"detail": "offending: none"
			},
			{
				"check": "information_gain_establishable",
				"passed": true,
				"detail": "retro-brief verdict='WORDING_ONLY_GAIN', unique non-local entities=0"
			}
		],
		"blocked_reason": "NO_SUPPORTED_DIFFERENTIATION",
		"recommended_action": "broaden_regional_scope"
	},
	"query_model": {
		"query_network_id": "queries/non-running.json",
		"primary_queries": [
			"how much non running car worth las vegas",
			"need know what's wrong car before calling",
			"tow car flat tires won't roll",
			"buy car sitting years won't start",
			"worth selling car blown engine"
		],
		"supporting_queries": [],
		"question_map": [
			{
				"question": "How much is a non-running car worth in Las Vegas?",
				"why_this_page_answers_it": "TO BE RESEARCHED",
				"coverage": "must_answer"
			},
			{
				"question": "Do I need to know what's wrong with my car before calling?",
				"why_this_page_answers_it": "TO BE RESEARCHED",
				"coverage": "must_answer"
			},
			{
				"question": "Can you tow a car that has flat tires and won't roll?",
				"why_this_page_answers_it": "TO BE RESEARCHED",
				"coverage": "must_answer"
			},
			{
				"question": "Will you buy a car that has been sitting for years and won't start?",
				"why_this_page_answers_it": "TO BE RESEARCHED",
				"coverage": "must_answer"
			},
			{
				"question": "Is it worth selling a car with a blown engine?",
				"why_this_page_answers_it": "TO BE RESEARCHED",
				"coverage": "must_answer"
			}
		],
		"objection_map": [
			{
				"objection": "Is the quoted price the price I actually get?",
				"required_response": "Needs a sourced statement of the firm-offer policy."
			},
			{
				"objection": "Can I sell without the title?",
				"required_response": "Needs an authoritative Nevada DMV source before answering."
			}
		],
		"concept_groups": [
			{
				"concept": "car how las much non",
				"intent": "transactional",
				"why_needed": "How much is a non-running car worth in Las Vegas?",
				"coverage": "useful_if_relevant",
				"representative_queries": [
					"how much non running car worth las vegas"
				],
				"shared_with_siblings": true
			},
			{
				"concept": "before calling car know need",
				"intent": "transactional",
				"why_needed": "Do I need to know what's wrong with my car before calling?",
				"coverage": "must_answer",
				"representative_queries": [
					"need know what's wrong car before calling"
				],
				"shared_with_siblings": false
			},
			{
				"concept": "car flat roll tires tow",
				"intent": "transactional",
				"why_needed": "Can you tow a car that has flat tires and won't roll?",
				"coverage": "must_answer",
				"representative_queries": [
					"tow car flat tires won't roll"
				],
				"shared_with_siblings": false
			},
			{
				"concept": "buy car sitting start won't",
				"intent": "transactional",
				"why_needed": "Will you buy a car that has been sitting for years and won't start?",
				"coverage": "useful_if_relevant",
				"representative_queries": [
					"buy car sitting years won't start"
				],
				"shared_with_siblings": true
			},
			{
				"concept": "blown car engine selling worth",
				"intent": "transactional",
				"why_needed": "Is it worth selling a car with a blown engine?",
				"coverage": "useful_if_relevant",
				"representative_queries": [
					"worth selling car blown engine"
				],
				"shared_with_siblings": true
			}
		]
	},
	"entity_model": {
		"primary_entity": "junk car buying — non running",
		"supporting_entities": [
			"Call",
			"Non",
			"Yes"
		],
		"local_entities": [
			"Las Vegas"
		],
		"user_entities": [],
		"process_entities": [
			"flatbed",
			"offer",
			"scrap",
			"tow",
			"towing"
		],
		"attributes": [
			"blown",
			"broken",
			"running"
		],
		"entity_relationships": [
			{
				"chain": [
					"local",
					"co-occurs_with",
					"process"
				],
				"evidence_level": "research_observation",
				"claim_id": "",
				"explain_because": "Co-occurrence in existing copy. Evidence that the page connects these ideas — not evidence that the connection holds."
			},
			{
				"chain": [
					"attributes_condition",
					"co-occurs_with",
					"process"
				],
				"evidence_level": "research_observation",
				"claim_id": "",
				"explain_because": "Co-occurrence in existing copy. Evidence that the page connects these ideas — not evidence that the connection holds."
			},
			{
				"chain": [
					"attributes_condition",
					"co-occurs_with",
					"local"
				],
				"evidence_level": "research_observation",
				"claim_id": "",
				"explain_because": "Co-occurrence in existing copy. Evidence that the page connects these ideas — not evidence that the connection holds."
			},
			{
				"chain": [
					"vehicle condition",
					"determines",
					"towing requirement"
				],
				"evidence_level": "hypothesis",
				"claim_id": "",
				"explain_because": "Plausible domain relationship, unverified for this page."
			},
			{
				"chain": [
					"vehicle ownership",
					"determines",
					"title and documentation path"
				],
				"evidence_level": "hypothesis",
				"claim_id": "",
				"explain_because": "Plausible domain relationship, unverified for this page."
			},
			{
				"chain": [
					"community rules",
					"creates",
					"vehicle removal pressure"
				],
				"evidence_level": "hypothesis",
				"claim_id": "",
				"explain_because": "Plausible domain relationship, unverified for this page."
			},
			{
				"chain": [
					"location",
					"determines",
					"pickup and logistics context"
				],
				"evidence_level": "hypothesis",
				"claim_id": "",
				"explain_because": "Plausible domain relationship, unverified for this page."
			}
		]
	},
	"local_model": {
		"location": "junk car buying — non running",
		"local_context": [
			"Las Vegas"
		],
		"local_conditions": [],
		"geographic_context": [],
		"customer_scenarios": [],
		"decision_factors": []
	},
	"differentiation": {
		"approved_angle_id": "",
		"angle_statement": "",
		"angle_evidence": [],
		"why_this_page_exists": "NOT ESTABLISHED — this page has no approved angle.",
		"must_not_overlap_with": [
			"damaged",
			"sedans",
			"trucks-suvs"
		],
		"forbidden_generic_patterns": [
			"Swapping a city, neighbourhood, ZIP or landmark name for a sibling's and calling it different",
			"Reusing a sibling's section order — identical structure was 50 of 68 sibling pairs",
			"Restating a sibling's FAQ substance in new wording",
			"Explaining the same generic process every sibling already explains",
			"Inserting keyword variants that a person would not say out loud",
			"Padding to reach a word count"
		]
	},
	"information_gain": {
		"required_new_information": [
			{
				"information": "NO ESTABLISHED INFORMATION GAIN",
				"why_it_is_new": "Nothing measured or researched distinguishes this page from its siblings. This brief is blocked; the gap must be closed by research, never by invention.",
				"evidence_level": "unknown_needs_verification"
			}
		],
		"unique_explanations": [],
		"unique_scenarios": [],
		"unique_questions": [
			"How much is a non-running car worth in Las Vegas?",
			"Do I need to know what's wrong with my car before calling?",
			"Can you tow a car that has flat tires and won't roll?",
			"Will you buy a car that has been sitting for years and won't start?",
			"Is it worth selling a car with a blown engine?"
		],
		"unique_decision_factors": [],
		"sibling_coverage_gaps": []
	},
	"content_architecture": {
		"structure_rationale": "NOT PLANNED — the page is blocked, so no structure is proposed. Proposing one would invite a page to be written that has no reason to exist.",
		"recommended_sections": [
			{
				"section_type": "content",
				"working_title": "BLOCKED",
				"purpose": "No section plan — this page did not pass the existence gate."
			}
		]
	},
	"faq_plan": {
		"questions_to_answer": [
			"How much is a non-running car worth in Las Vegas?",
			"Do I need to know what's wrong with my car before calling?",
			"Can you tow a car that has flat tires and won't roll?",
			"Will you buy a car that has been sitting for years and won't start?",
			"Is it worth selling a car with a blown engine?"
		],
		"questions_already_answered_by_siblings": [
			"trucks-suvs — FAQ substance already overlaps; ask different questions",
			"already answered on damaged: How much is a totaled car worth in Las Vegas?",
			"already answered on damaged: Do you buy cars with salvage titles?",
			"already answered on damaged: Can you pick up a damaged car from a tow yard?",
			"already answered on damaged: Do you buy flood-damaged cars?",
			"already answered on sedans: How much is my junk sedan worth?",
			"already answered on sedans: Do you buy sedans that don't run?",